{
  "mode": "IndexedRetrieval",
  "model": "MAP-I",
  "dim": 10000,
  "codebooks": ["blake3:codebook_items01"],
  "decode": { "procedure": "Cleanup", "cleanup_threshold": 0.3 },
  "bound": { "kind": "ProbabilityBound", "delta": 0.001, "basis": { "kind": "ProvenThm", "citation": "Clarkson Thm 16" } }
}
